### ISSUE TITLE
Slow response when concurrent clients connect

### ISSUE THREAD

**Issue by azrle** [nats-io/nats-server#988]
- [x] Defect
 - [ ] Feature Request or Change Proposal
 
## Defects 

It takes time (~ 3 seconds) for nats-server to establish connections when a lot of new connections come concurrently.
 
#### Versions of `gnatsd` and affected client libraries used:
2.0-RC11

#### OS/Container environment:
Ubuntu 16.04 (client: cnats 1.7.6)

#### Steps or code to reproduce the issue:
1. Build a nats-server cluster
2. Create a large amount of connections to the cluster (say 1000+) simultaneously (< 500ms)
 
#### Expected result:
The connection should be established within 1 second.

#### Actual result:
```
09:02:41.452738 IP 10.228.255.152.38288 > 10.228.193.29.4222: Flags [S], seq 3354597297, win 65535, options [mss 1420,nop,nop,sackOK,nop,wscale 11], length 0
09:02:41.453731 IP 10.228.193.29.4222 > 10.228.255.152.38288: Flags [S.], seq 1515096616, ack 3354597298, win 65535, options [mss 1420,nop,nop,sackOK,nop,wscale 11], length 0
09:02:41.453767 IP 10.228.255.152.38288 > 10.228.193.29.4222: Flags [.], ack 1, win 8192, length 0
# Timeout maybe?
09:02:43.451637 IP 10.228.255.152.38288 > 10.228.193.29.4222: Flags [F.], seq 1, ack 1, win 8192, length 0
09:02:43.455534 IP 10.228.193.29.4222 > 10.228.255.152.38288: Flags [.], ack 2, win 8192, length 0
# NATS responses INFO
09:02:44.100083 IP 10.228.193.29.4222 > 10.228.255.152.38288: Flags [P.], seq 1:4081, ack 2, win 8192, length 4080
09:02:44.100120 IP 10.228.255.152.38288 > 10.228.193.29.4222: Flags [R], seq 3354597299, win 0, length 0
```

**Comment by derekcollison** [comment]
Do the clients also do subscriptions upon connect?

**Comment by derekcollison** [comment]
How large is the cluster, is this a large cluster with ~100 servers?

**Comment by azrle** [comment]
> How large is the cluster, is this a large cluster with ~100 servers?

Yes.

> Do the clients also do subscriptions upon connect?

Nope. Just connect to the cluster.

**Comment by derekcollison** [comment]
Is this a reconnect where they had subscriptions?

**Comment by azrle** [comment]
Unlikely. It happened at very beginning when a client is trying to connect the cluster.
As our logs show, before the issue happened, it did not connect to the cluster yet.

_I think I should put the note here as it may help others review this issue: RC8 does not have this issue._
